{
  "$schema": "http://json-schema.org/draft-07/schema#",
  "$id": "https://3webobs.com/schemas/aliases.json",
  "title": "aliases.json",
  "description": "Minimal structural schema for aliases.json, published by 3webs (AIVENTURE S.R.L.). Describes the top-level shape actually present in the live file; nested object internals are intentionally left permissive (additionalProperties: true) rather than over-specified.",
  "type": "object",
  "properties": {
    "version": {
      "type": "string"
    },
    "generated": {
      "type": "string"
    },
    "purpose": {
      "type": "string"
    },
    "canonical": {
      "type": "object"
    },
    "brand_aliases": {
      "type": "array",
      "items": {
        "type": "object"
      }
    },
    "domain_aliases": {
      "type": "array",
      "items": {
        "type": "object"
      }
    },
    "legal_entity_aliases": {
      "type": "array",
      "items": {
        "type": "object"
      }
    },
    "person_aliases": {
      "type": "array",
      "items": {
        "type": "object"
      }
    },
    "historical_names": {
      "type": "array",
      "items": {
        "type": "object"
      }
    },
    "related_entities": {
      "type": "array",
      "items": {
        "type": "object"
      }
    },
    "resolution_rules": {
      "type": "array",
      "items": {
        "type": "object"
      }
    },
    "do_not_merge": {
      "type": "array",
      "items": {
        "type": "object"
      }
    },
    "not_affiliated": {
      "type": "array",
      "items": {
        "type": "string"
      }
    },
    "related_resources": {
      "type": "object"
    }
  },
  "required": [
    "version",
    "generated",
    "purpose",
    "canonical",
    "brand_aliases",
    "domain_aliases",
    "legal_entity_aliases",
    "person_aliases",
    "historical_names",
    "related_entities",
    "resolution_rules",
    "do_not_merge",
    "not_affiliated",
    "related_resources"
  ],
  "additionalProperties": true
}
